group,wh_word,item,q_type,sound_file,a_type,context,dice,interlocutor,tu_dices,target,pregunta,option1,option2,option3,answer
A,dónde,21,RQ+,f_donde_21_RQplus,unique referent,"En tu pueblo natal hay dos lugares donde puedes conseguir cualquier tipo de alimento: el supermercado, que vende productos empaquetados, y el mercado, que vende productos a granel. Tu hermana menor quiere comprar dulces tradicionales para su fiesta de cumpleaños y te pregunta dónde podría conseguirlos en grandes cantidades. Tú le contestas sugiriendo que la respuesta es obvia.",Tu hermana dice:,"""Oye quiero comprar dulces a granel para mi fiesta. ¿Sabes a dónde podría ir?""",Tú dices:,"""Es obvio, ¿no? ¿Dónde se compra a granel?""",¿Qué es lo que realmente implicas o quieres decir?,Quieres saber dónde se compra a granel.,No crees que se pueda comprar a granel en ningún lado.,Ya sabes dónde se compra a granel.,option3
A,dónde,22,ISQ,m_donde_22_ISQ,mention-some,"Tu amigo Juan y tú están en una clase de biología revisando unas notas sobre flora que pueden encontrar en tu país. A Juan le llama la atención una nota sobre los lirios y tú quisieras saber si en tu ciudad se pueden encontrar en estado natural y, de ser así, en qué parte podrías encontrarlos. Así que decides preguntarle a la profesora.",Juan dice:,"""Mira, este texto sobre lirios es interesante. Me pregunto si será posible encontrarlos en la ciudad.""",Tú dices:,"""Profesora, aquí dice que los lirios crecen en nuestro país. ¿Dónde tienen lirios?""",¿Qué es lo que realmente implicas o quieres decir?,Quieres saber dónde tienen lirios.,No crees que tengan lirios en ninguna parte.,Ya sabes dónde tienen lirios.,option1
B,dónde,22,RQ-,f_donde_22_RQ-,domain complement,Juana y tú viven en una ciudad muy industrializada donde no es fácil encontrar mercados que vendan plantas. Un día Juana lee en un libro acerca de los lirios y te dice que quisiera comprar unos. Le respondes sugiriendo que no podrían tener en ningún lado.,Juana dice:,"""Quisiera comprar unos lirios.""",Tú dices:,"""Pero aquí no hay mercados. ¿Dónde tienen lirios?""",¿Qué es lo que realmente implicas o quieres decir?,Quieres saber dónde tienen lirios.,No crees que tengan lirios en ninguna parte.,Ya sabes dónde tienen lirios.,option2
C,dónde,22,RQ+,f_donde_22_RQplus,unique referent,"La familia de tu amigo Jorge acaba de abrir un puesto de flores en el mercado del centro de tu ciudad y todos saben acerca de él. Un día tu mamá te pregunta dónde se podria comprar lirios, y tú le sugieres que ya debería saber la respuesta porque Jorge les acaba de dar la noticia.",Tu mamá dice:,"""Oye, María me preguntaba si sabes en qué lugar podría conseguir lirios.""",Tú dices:,"""Pues, piensa en lo que Jorge nos dijo la última vez. ¿Dónde tienen lirios?""",¿Qué es lo que realmente implicas o quieres decir?,Quieres saber dónde tienen lirios.,No crees que tengan lirios en ninguna parte.,Ya sabes dónde tienen lirios.,option3
C,dónde,23,ISQ,m_donde_23_ISQ,mention-some,"Estás en una clase de historia de la cocina. El tema de la clase de hoy es el uso de insectos en la cocina. La maestra menciona que tres de los insectos más comunes en la cultura culinaria son los escarabajos, las hormigas y los grillos. Juan te dice que ha ido a lugares donde se comen escarabajos y hormigas, pero no sabe en qué lugar se consiguen grillos. Por eso le preguntas a la profesora.",Juan dice:,"""Yo he comido escarabajos y hormigas, pero no sé en qué lugar se coman grillos. ¿Por qué no le preguntas a la profesora?""",Tú dices:,"""Profesora, tenemos una pregunta. ¿Dónde se comen grillos?""",¿Qué es lo que realmente implicas o quieres decir?,Quieres saber dónde se comen grillos.,No crees que se coman grillos en ninguna parte.,Ya sabes dónde comen grillos.,option1
A,dónde,23,RQ-,m_donde_23_RQ-,domain complement,"Desde pequeño le tienes un poco de asco a los insectos. Cuando hablas con Juan sobre insectos, le mencionas lugares donde se comen escarabajos y hormigas. De acuerdo con Juan, la gente come grillos también, pero no está seguro dónde. Tú te muestras incrédulo.",Juan dice:,"""Te digo que es cierto. La gente come grillos.""",Tú dices:,"""¡Qué asco! No puedo creerlo. ¿Dónde se comen grillos?""",¿Qué es lo que realmente implicas o quieres decir?,Quieres saber dónde se comen grillos.,No crees que se coman grillos en ninguna parte.,Ya sabes dónde comen grillos.,option2
B,dónde,23,RQ+,m_donde_23_RQplus,unique referent,"Tienes un amigo del sur de México, Julio, que siempre te platica que el pueblo de donde viene es famoso por el uso de insectos en la cocina. Él y tú viven en la Ciudad de México. Un día, caminando por el mercado de la ciudad, ves un puesto que vende sal de grillo del sur. Cuando se la muestras a Julio, él te pregunta de dónde es y tú sugieres que es del sur.",Julio dice:,"""¿De dónde será esta sal?""",Tú dices:,"""Me preguntas como si no supieras. ¿Dónde se comen grillos?""",¿Qué es lo que realmente implicas o quieres decir?,Quieres saber dónde se comen grillos.,No crees que se coman grillos en ninguna parte.,Ya sabes dónde comen grillos.,option3
B,dónde,24,ISQ,f_donde_24_ISQ,mention-some,"Tu amigo y tú van a un pueblo que es famoso por sus empanadas. A la hora del lunch, ambos están hambrientos y deciden preguntar a alguien dónde conseguir una. Se acercan a una señora.",La señora dice:,"""¿Qué se les ofrece, chicos?""",Tú dices:,"""Oiga, ¿nos puede ayudar? No conocemos este vecindario. ¿Dónde venden empanadas?""",¿Qué es lo que realmente implicas o quieres decir?,Quieres saber dónde venden empanadas.,Crees que no vendan empanadas en ningún lado.,Ya sabes dónde venden empanadas.,option1
C,dónde,24,RQ-,f_donde_24_RQ-,domain complement,"Vives en Canadá en una ciudad donde no es muy común encontrar comida latinoamericana. Un día a tu mamá se le antoja comer una empanada y decide salir a buscar una tienda donde las vendan. Te avisa, y tú, sabiendo que es difícil encontrar empanadas en la ciudad, le sugieres que no venderían en ningún lado.",Tu mamá dice:,"""Voy a ir a buscar empanadas.""",Tú dices:,"""¿Aquí en esta ciudad? ¿Dónde venden empanadas?""",¿Qué es lo que realmente implicas o quieres decir?,Quieres saber dónde venden empanadas.,Crees que no vendan empanadas en ningún lado.,Ya sabes dónde venden empanadas.,option2
A,dónde,24,RQ+,f_donde_24_RQplus,unique referent,"Vas caminando con tu amiga Luisa en una plaza comercial. Después de un rato de caminar, te da hambre y le pides a Luisa que te acompañe a la sección de comida de la plaza. Al llegar te paras frente a dos locales: una panadería y una dulcería. Luisa te pregunta dónde crees que podrían vender empanadas. Le respondes sugiriendo que es obvio dónde.",Luisa dice:,"""¿A cuál entramos?""",Tú dices:,"""¿En serio? ¿Entre la panadería y la dulcería? ¿Dónde venden empanadas?""",¿Qué es lo que realmente implicas o quieres decir?,Quieres saber dónde venden empanadas.,Crees que no vendan empanadas en ningún lado.,Ya sabes dónde venden empanadas.,option3