group,wh_word,item,q_type,sound_file,a_type,context,dice,interlocutor,tu_dices,target,pregunta,option1,option2,option3,answer
A,quién,1,ISQ,f_quien_1_ISQ,unique referent,"Acabas de enterarte de que Liliana, tu compañera de clase, es la única que no pasó el examen final de un curso. Ni tú ni tus compañeros de clase quieren llamarle a Liliana para darle la mala noticia. Al día siguiente tu amiga María te dice que Liliana se enteró de que no pasó el curso. A ti te sorprende que se haya enterado, pues nadie en el salón quería llamarla.",María dice:,"""Qué extraño que Liliana se haya enterado de su calificación.""",Tú dices:,"""Sí, es lo mismo que pensé. ¿Quién llamaría a Liliana?""",¿Qué es lo que realmente implicas o quieres decir?,Quieres saber quién llamaría a Liliana.,Crees que nadie llamaría a Liliana.,Ya sabes quién llamaría a Liliana.,option1
B,quién,1,RQ-,m_quien_1_RQ-,domain complement,"Tú y tus amigos están por salir. Liliana es una amiga de Miguel, pero a ninguno de tus otros amigos le cae bien. Tu amigo Miguel se pregunta si Liliana vendría con ustedes pero ustedes dos ya saben que a nadie le cae bien y nadie la llamaría para salir.",Miguel dice:,"""¿Va a venir Liliana también?""",Tú dices:,"""¡Me sorprendería mucho! ¿Quién llamaría a Liliana?""",¿Qué es lo que realmente implicas o quieres decir?,Quieres saber quién llamaría a Liliana.,Crees que nadie llamaría a Liliana.,Ya sabes quién llamaría a Liliana.,option2
C,quién,1,RQ+,m_quien_1_RQplus,unique referent,"Tú y tus amigos planean ir al Festival Internacional de Cine de Toronto. Quieres ir sólo con tus mejores amigos: Dante y Miguel. De repente, aparece Liliana y tú te quedas sorprendido porque estás seguro de que no la invitaste. Todo el mundo sabe que Miguel adora a Liliana y que sigue llamándola e invitándola a salir todo el tiempo. Parece que Miguel fue quien invitó a Liliana, aunque habían decidido que sólo tú, Miguel y Dante iban a ir al Festival.",Dante dice:,"""Me pregunto quién le dijo de nuestros planes.""",Tú dices:,"""Me parece muy obvio: ¿Quién llamaría a Liliana?""",¿Qué es lo que realmente implicas o quieres decir?,Quieres saber quién llamaría a Liliana.,Crees que nadie llamaría a Liliana.,Ya sabes quién llamaría a Liliana.,option3
C,quién,2,ISQ,f_quien_2_ISQ,mention-some,"Estás organizando una fiesta con dos amigos y hay una lista de 91 invitados. Ustedes dividen la lista y cada uno tiene el encargo de invitar 30 personas. Hacen tres listas con los nombres que les corresponden a cada uno, pero olvidan incluir a la última persona: Elena. El día de la fiesta, se dan cuenta de que olvidaron invitarla, pero les sorprende cuando la ven llegar al evento una hora después.",Tu amiga dice:,"""Qué bueno que Elena está aquí, ¿no?""",Tú dices:,"""Por supuesto! Pero no sé cómo es que está aquí si olvidamos invitarla. ¿Quién invitaría a Elena?""",¿Qué es lo que realmente implicas o quieres decir?,Quieres saber quién la invitaría a Elena.,Crees que nadie la invitaría a Elena.,Ya sabes quién es la persona que la invitaría a Elena.,option1
A,quién,2,RQ-,f_quien_2_RQ-,domain complement,"Elena, tu compañera de clase, no le cae bien a nadie. Tu clase tiene un grupo en Facebook al cual se tiene acceso sólo con invitación. Cuando Laura se da cuenta que Elena no es parte del grupo, tú le sugieres que es porque nadie la invitaría.",Laura dice:,"""No veo a Elena en el grupo.""",Tú dices:,"""¡Claro! ¿Quién invitaría a Elena?""",¿Qué es lo que realmente implicas o quieres decir?,Quieres saber quién la invitaría a Elena.,Crees que nadie la invitaría a Elena.,Ya sabes quién es la persona que la invitaría a Elena.,option2
B,quién,2,RQ+,m_quien_2_RQplus,unique referent,"Tú y tu hermano organizan una ida al cine e invitan a todos tus primos, pero se les olvida invitar a tu prima Elena. El día de la función, ves que Elena llega a la sala de cine y los saluda. Tu hermano te pregunta quién habría invitado a Elena si ustedes lo habían olvidado. Todos saben que Elena y tu hermana son muy cercanas, le sugieres que es obvio quién la invitó.",Tu hermano dice:,"""Me pregunto quién le dijo a Elena del plan.""",Tú dices:,"""Me parece muy obvio: ¿Quién la invitaría a Elena?""",¿Qué es lo que realmente implicas o quieres decir?,Quieres saber quién la invitaría a Elena.,Crees que nadie la invitaría a Elena.,Ya sabes quién es la persona que la invitaría a Elena.,option3
B,quién,3,ISQ,f_quien_3_ISQ,unique referent,"La sociedad de alumnos de tu universidad va a tener elecciones para que cada departamento tenga un representante. Tú y Juanita hacen un sondeo y juntan firmas de apoyo para cada candidato. Al final, ves que Emilia recibe el apoyo de una sola persona pero no distingues qué nombre está escrito.",Juanita dice:,"""Sólo una persona firmó por Emilia.""",Tú dices:,"""No se ve la firma. ¿Quién apoyaría a Emilia?""",¿Qué es lo que realmente implicas o quieres decir?,Quieres saber quién apoyaría a Emilia.,Crees que nadie apoyaría a Emilia.,Ya sabes quién es la persona que apoyaría a Emilia.,option1
C,quién,3,RQ-,m_quien_3_RQ-,domain complement,"Emilia, una chica de tu departamento, es perezosa, mezquina, y grosera. La sociedad de alumnos en tu universidad tiene que elegir un nuevo presidente y Emilia quiere ser una candidata. Un compañero tuyo te da la noticia y tú le sugieres que nadie apoyaría a Emilia.",Tu compañero dice:,"""Oye, ¿sabías que Emilia quiere ser candidata?""",Tú dices:,"""¡Qué raro! ¿Quién apoyaría a Emilia?""",¿Qué es lo que realmente implicas o quieres decir?,Quieres saber quién apoyaría a Emilia.,Crees que nadie apoyaría a Emilia.,Ya sabes quién es la persona que apoyaría a Emilia.,option2
A,quién,3,RQ+,f_quien_3_RQplus,unique referent,La sociedad de alumnos de tu universidad tiene que elegir un nuevo presidente y Emilia quiere ser una candidata. El papá de Emilia es el Decano de la universidad. Manuela cree que es poco probable que Emilia gane pero tú crees que ella va a ganar porque la apoyaría su padre.,Manuela dice:,"""No creo que Emilia gane.""",Tú dices:,"""Es muy probable que gane. Piénsalo. ¿Quién apoyaría a Emilia?""",¿Qué es lo que realmente implicas o quieres decir?,Quieres saber quién apoyaría a Emilia.,Crees que nadie apoyaría a Emilia.,Ya sabes quién es la persona que apoyaría a Emilia.,option3
A,quién,4,ISQ,m_quien_4_ISQ,unique referent,"Tú y tus amigos del departamento de antropología están en un proyecto juntos. Tienen que juntar narraciones de personas distintas. Tu amigo Juan dice que Amelia pasó el verano entero juntando narraciones y te sugiere que podrían usar esos datos para su proyecto de clase, pero alguien tendría que hablar con ella y ni tú ni Juan la conocen bien. Al día siguiente, recibes un correo con las narraciones, y tú no sabes quién le habría llamado a Amelia para pedirle el favor.",Juan dice:,"""Nos llegaron las narraciones. Viste el correo, ¿no?""",Tú dices:,"""Sí. Qué raro. ¿Quién le hablaría a Amelia?""",¿Qué es lo que realmente implicas o quieres decir?,Quieres saber quién le hablaría a Amelia.,Crees que nadie le hablaría a Amelia.,Ya sabes quién es la persona que hablaría a Amelia.,option1
B,quién,4,RQ-,f_quien_4_RQ-,domain complement,"Tu hermana se va a casar y quiere saber a quién de la familia debería o no debería invitar. Tu prima Amelia no se lleva bien con nadie y nadie quiere hablar con ella, ya que en la última boda se emborrachó y les robó los zapatos a todos los invitados. Tu hermana decide no invitar a Amelia pero el día de su boda, Amelia está allí. Sabiendo que Amelia les cae mal a todos los invitados, tu hermana se extraña de verla ahí y piensa que alguien tuvo que haberla invitado.",Tu hermana dice:,"""Amelia se enteró de la fiesta. Alguien de la familia tuvo que haberla invitado.""",Tú dices:,"""Es muy poco probable. ¿Quién le hablaría a Amelia?""",¿Qué es lo que realmente implicas o quieres decir?,Quieres saber quién le hablaría a Amelia.,Crees que nadie le hablaría a Amelia.,Ya sabes quién es la persona que hablaría a Amelia.,option2
C,quién,4,RQ+,m_quien_4_RQplus,unique referent,"Tú y tus colegas quieren convencer a tu jefa, Amelia, que sería una buena idea tener clases de yoga gratis en la oficina. No es fácil convencer a Amelia, pero todo el mundo sabe que ella y Alejandra son muy buenas amigas. Alejandra también parece estar de acuerdo con la idea de las clases de yoga y podría convencerla. Un compañero tuyo se siente escéptico al respecto, pero tú sabes que Alejandra podría hablar con Amelia.",Tu compañero dice:,"""No sé cómo vamos a convencer a Amelia.""",Tú dices:,"""No te rindas tan facilmente. Todavía tenemos una posibilidad. ¿Quién le hablaría a Amelia?""",¿Qué es lo que realmente implicas o quieres decir?,Quieres saber quién le hablaría a Amelia.,Crees que nadie le hablaría a Amelia.,Ya sabes quién es la persona que hablaría a Amelia.,option3
C,quién,5,ISQ,f_quien_5_ISQ,mention-all,"Eres profesora y una de tus alumnas, Ivana, estuvo enferma por un tiempo. Cuando vuelve a la escuela, necesita ayuda con la tarea. Quieres asignarle un tutor para cada tarde de esta semana. Juanita se ofrece a ayudar, pero quieres ver si hay otra gente que está disponible también.",Juanita dice:,"""Yo puedo ayudarla.""",Tú dices:,"""Primero, me gustaría ver cuanta gente puede ayudarla. ¿Quién ayudaría a Ivana?""",¿Qué es lo que realmente implicas o quieres decir?,Quieres saber quién ayudaría a Ivana.,Crees que nadie ayudaría a Ivana.,Ya sabes quién es la persona que ayudaría a Ivana.,option1
A,quién,5,RQ-,m_quien_5_RQ-,domain complement,"Ivana es notoriamente egoísta. Siempre acepta ayuda de los demás pero cuando le toca ayudar a alguien, no se puede contar con ella. Acabas de enterarte que hace poco Ivana tuvo un accidente y ahora está en el hospital. No tiene a nadie que saque a su perro a caminar y ella se queja de esto en Facebook. Cuando Juan ve su post, tu le sugieres que eso es de esperarse porque nadie la quiere ayudar.",Juan dice:,"""Ella dice que no tiene a nadie que la ayude.""",Tú dices:,"""¡Claro! ¿Quién ayudaría a Ivana?""",¿Qué es lo que realmente implicas o quieres decir?,Quieres saber quién ayudaría a Ivana.,Crees que nadie ayudaría a Ivana.,Ya sabes quién es la persona que ayudaría a Ivana.,option2
B,quién,5,RQ+,f_quien_5_RQplus,unique referent,"Dos alumnos tuyos, Ivana y Ana, tuvieron un accidente y ahora están en el hospital. El año escolar sigue y estar al tanto con las clases resulta ser muy difícil. Entonces hablas con tus colegas de la posibilidad que Ivana y Ana dejen de ir a la escuela por un año (para recuperarse). La asignatura más difícil es matemáticas, pero la gemela de Ivana, Ivona, tiene un talento excepcional en esta asignatura y podría ayudar a las dos chicas si deciden continuar en el año escolar. Cuando la profesora de matemáticas, Olivia, dice que está preocupada por el aprendizaje de Ivana, tú le dices que no hay problema porque es obvio que su hermana Ivona la va a ayudar.",Olivia dice:,"""Si las chicas deciden seguir con el año escolar, ¿crees que Ivana va a recibir todo el apoyo que necesita?""",Tú dices:,"""¡Claro! Piénsalo. ¿Quién ayudaría a Ivana?""",¿Qué es lo que realmente implicas o quieres decir?,Quieres saber quién ayudaría a Ivana.,Crees que nadie ayudaría a Ivana.,Ya sabes quién es la persona que ayudaría a Ivana.,option3
B,quién,6,ISQ,m_quien_6_ISQ,mention-all,"Eres profesor y le quieres enseñar a tu clase algo sobre la ingenuidad. Manuela, una alumna, se ofrece para el experimento. Tú quieres saber cuántas personas le creerían a Manuela si ella se les acercara en la calle y les pidiera dinero. Dante te pide que expliques bien el experimento.",Dante dice:,"""¿En qué situación encontramos a Manuela?""",Tú dices:,"""Imagina que no la conoces y ella se te acerca por la calle mientras lleva el uniforme de una escuela. Te dice que le robaron el bolsillo y el celular y necesita dinero para volver a casa. Levanten la mano. ¿Quién le creería a Manuela?""",¿Qué es lo que realmente implicas o quieres decir?,Quieres saber quién le creería a Manuela.,Crees que nadie le creería a Manuela.,Ya sabes quién es la persona que le creería a Manuela.,option1
C,quién,6,RQ-,f_quien_6_RQ-,domain complement,"Manuela es notablemente mentirosa y, por supuesto, nadie cree las cosas que dice. Liliana te cuenta que Manuela está ahora alegando tener una carrera en medicina. Esto era claramente una mentira y Liliana está preocupada que la gente vaya a creerle a Manuela. Sin embargo, tú sugieres que no es gran problema porque todos saben que ella tiende a mentir.",Liliana dice:,"""Lo que Manuela está haciendo es peligroso. La gente creerá que ella es médico, pero no lo es.""",Tú dices:,"""No te preocupes, no hay ningún problema. ¿Quién le creería a Manuela?""",¿Qué es lo que realmente implicas o quieres decir?,Quieres saber quién le creería a Manuela.,Crees que nadie le creería a Manuela.,Ya sabes quién es la persona que le creería a Manuela.,option2
A,quién,6,RQ+,m_quien_6_RQplus,unique referent,"Manuela quiere reclutar personas para su estafa piramidal. Es algo que se debería evitar, pero hay gente que le creyó y se unió. Una de estas personas es tu colega Miguel, que es notoriamente ingenuo. Cuando tu otro colega, Emilio, se entera que Manuela logró convencer a alguien de tu oficina, le sugieres que será Miguel porque nadie es tan ingenuo como él.",Emilio dice:,"""Sé que alguien de nuestra oficina es parte de la estafa piramidal de Manuela pero no sé quién es.""",Tú dices:,"""Sólo puede ser una persona. ¿Quién le creería a Manuela?""",¿Qué es lo que realmente implicas o quieres decir?,Quieres saber quién le creería a Manuela.,Crees que nadie le creería a Manuela.,Ya sabes quién es la persona que le creería a Manuela.,option3
A,quién,7,ISQ,f_quien_7_ISQ,unique referent,"Laureana es una chica de tu clase de matemáticas. Ella es muy enfermiza y falta a clase constantemente, unas dos o tres veces a la semana. Sin embargo, esta vez Laureana lleva sin ir a clase casi dos semanas seguidas. La profesora está preocupada por ella y le pregunta a los alumnos si alguien podría comunicarse con ella, saludarla y preguntarle si está bien. Al día siguiente la directora de la escuela informa que Laureana se comunicó a la escuela diciendo que recibió el recado de la profesora y que regresará pronto a clases. La profesora se pregunta quién habrá preguntado a Laureana si estaba bien.",La directora dice:,"""Laureana se comunicó conmigo ayer. Dice que recibió su recado y que regresará pronto a la escuela.""",Tú dices:,"""No sé quién le dio el mensaje. ¿Quién le preguntaría a Laureana?""",¿Qué es lo que realmente implicas o quieres decir?,Quieres saber quién le preguntaría a Laureana.,Crees que nadie le preguntaría a Laureana.,Ya sabes quién es la persona que le preguntaría a Laureana.,option1
B,quién,7,RQ-,f_quien_7_RQ-,domain complement,"Laureana es una chica muy reservada de tu clase que no habla mucho con otra gente y, en general, otros alumnos tienden a ignorarla. Un día, en tu clase de biología, la profesora les pide que entreguen un trabajo obligatoriamente en equipo para la siguiente sesión. Tu formas equipo con tu amigo Alfonso, y todos los demás alumnos forman los suyos, excepto Laureana, quien se queda sola y decide hacer el trabajo por su cuenta. En la siguiente sesión, al recoger los trabajos de los alumnos, tu profesora se da cuenta de que Laureana no tiene equipo y lo ha hecho sola, por lo que no puede recibirle la tarea. Tu amiga Ana sabe que tú eres muy empático y social, y expresa que ella asumía que tú, siendo tan sociable, habrías de preguntarle a Laureana si ya tenía equipo. Tú te excusas contestando que era poco probable que cualquier persona le preguntara a Laureana si ya estaba en un equipo.",Ana dice:,"""Yo pensé que le habías preguntado a Laureana si tenía equipo. De otra manera, la hubiéramos invitado al nuestro.""",Tú dices:,"""Por supuesto que no le pregunté. ¿Quién le preguntaría a Laureana?""",¿Qué es lo que realmente implicas o quieres decir?,Quieres saber quién le preguntaría a Laureana.,Crees que nadie le preguntaría a Laureana.,Ya sabes quién es la persona que le preguntaría a Laureana.,option2
C,quién,7,RQ+,m_quien_7_RQplus,unique referent,"Laureana, Alfonsina, Miguel y tú son muy buenos y cercanos amigos. Siempre hacen equipo para los trabajos de la escuela. Un día, la profesora de biología les pide hacer un trabajo en parejas para la siguiente semana. Miguel te manda un mensaje a ti y a Alfonsina preguntando quién quiere estar en su equipo y tú le contestas que quisieras ser su pareja. En la siguiente sesión, mientras Miguel y tú entregan su trabajo, Miguel se da cuenta de que se olvidó preguntarle a Laureana si ella tenía equipo. No obstante, la profesora felicita al grupo porque todos entregaron sus tareas. Miguel se queda pensando quién le habría preguntado a Laureana si tenía equipo, pero tú le dices que es obvio quién le preguntó.",Miguel dice:,"""Se me olvidó ver si Laureana tenía equipo pero de alguna forma logró conseguir uno. Me pregunto cómo….""",Tú dices:,"""Hay sólo una posibilidad. ¿Quién le preguntaría a Laureana?""",¿Qué es lo que realmente implicas o quieres decir?,Quieres saber quién le preguntaría a Laureana.,Crees que nadie le preguntaría a Laureana.,Ya sabes quién es la persona que le preguntaría a Laureana.,option3
C,quién,8,ISQ,m_quien_8_ISQ,unique referent,"Leonora es una famosa política, gobernadora de una provincia de su país. Hace unos días, un noticiero de televisión difundió un documento anónimo que difamaba a Leonora, revelando cierta información controversial sobre su mandato como gobernadora. Leonora tiene diversos enemigos políticos dentro y fuera de su partido, y se preguntan quién de ellos podría haber mandado el documento que difamó a Leonora.",Juan dice:,"""¿Ya viste que alguien difamó a Leonora?, pero de entre tantos enemigos que tiene...""",Tú dices:,"""Sé que ya tiene muchos enemigos y escuché algo sobre el incidente pero no sé mucho. ¿Quién difamaría a Leonora?""",¿Qué es lo que realmente implicas o quieres decir?,Quieres saber quién difamaría a Leonora.,Crees que nadie difamaría a Leonora.,Ya sabes quién es la persona que difamaría a Leonora.,option1
A,quién,8,RQ-,f_quien_8_RQ-,domain complement,"Leonora es una famosa política, gobernadora de una provincia de su país. Hace unos días, un noticiero de televisión difundió un documento anónimo que difamaba a Leonora, revelando cierta información controversial sobre su mandato como gobernadora. Tu hermana y tú saben que Leonora es muy querida por la población de la provincia y hasta los partidos opositores la estiman y respetan su mandato. A tu hermana y a ti les extraña esta noticia, pues no pueden pensar en alguien que quiera quitarle la reputación como gobernadora a Leonora.",Tu hermana dice:,"""Es muy raro que alguien haya mandado un documento así.""",Tú dices:,"""Estoy de acuerdo. ¿Quién difamaría a Leonora?""",¿Qué es lo que realmente implicas o quieres decir?,Quieres saber quién difamaría a Leonora.,Crees que nadie difamaría a Leonora.,Ya sabes quién es la persona que difamaría a Leonora.,option2
B,quién,8,RQ+,f_quien_8_RQplus,unique referent,"Leonora es una famosa política, gobernadora de una provincia de su país. Hace unos días, un noticiero de televisión difundió un documento anónimo que difamaba a Leonora, revelando cierta información controversial sobre su mandato como gobernadora. Tu amiga Juana y tú saben que Leonora es en general muy querida en la provincia, pero tiene cierta enemistad con el partido político opositor, quien en el pasado ha querido desacreditar el mandato de Leonora haciendo pública información controversial sobre la gobernadora. Tu amiga Juana te pregunta quién podría haber enviado ese documento anónimo a la televisión si Leonora es muy estimada por la población. Tú, que sabes que los únicos que tienen enemistad con Leonora son los del partido contrario sabes que la respuesta es obviamente el líder de la oposición.",Juana dice:,"""Me pregunto quién habrá enviado el documento a la televisión.""",Tú dices:,"""Eso es obvio. ¿Quién difamaría a Leonora?""",¿Qué es lo que realmente implicas o quieres decir?,Quieres saber quién difamaría a Leonora.,Crees que nadie difamaría a Leonora.,Ya sabes quién es la persona que difamaría a Leonora.,option3
B,qué,9,ISQ,f_que_9_ISQ,mention-all,"Lorena es tu jefa. Acaba de tener un accidente con el coche y tus colegas le quieren mandar un regalito al hospital. No sabes si quieres ser parte del regalo porque no tienes una buena relación con ella. Pero todavía no has decidido si vas a participar, y tienes mucha curiosidad, quieres saber qué le van a mandar tus colegas. Cuando tu colega Rafaela te habla del regalo, tú pides más detalles.",Rafaela dice:,"""Casi todos van a contribuir.""",Tú dices:,"""No estoy segura si voy a participar. ¿Qué le enviarían a Lorena?""",¿Qué es lo que realmente implicas o quieres decir?,Quieres saber qué le enviarían a Lorena.,Crees que nadie participe en el regalo para Lorena.,Ya sabes qué le enviarían a Lorena.,option1
C,qué,9,RQ-,m_que_9_RQ-,domain complement,Los hijos de Juan y Lorena se fueron de vacaciones y van a estar fuera del país durante el cumpleaños de Lorena. Juan espera que sus hijos le manden algo a su esposa para el cumple pero resulta que les robaron todo a los hijos y ahora se encuentran sin dinero. Lorena entonces no va a recibir nada para su cumpleaños. Cuando Juan te cuenta el asunto te dice que esto es inadmisible pero tú le dices que es comprensible dada la situación en que se encuentran sus hijos.,Juan dice:,"""Lorena no recibirá regalo de cumpleaños, ¿Es que sus hijos no le enviarán nada?""",Tú dices:,"""¡No tienen dinero! ¿Qué le enviarían a Lorena?""",¿Qué es lo que realmente implicas o quieres decir?,Quieres saber qué le enviarían a Lorena.,Crees que no le enviarían nada a Lorena.,Ya sabes qué le enviarían a Lorena.,option2
A,qué,9,RQ+,f_que_9_RQplus,unique referent,"Tu colega Lorena se va a jubilar y todos los colegas quieren comprar y enviarle un regalo. A Lorena le gustan mucho las orquídeas. De hecho su oficina está llena de todos tipos de orquídeas. Tu otra colega Pilar llega tarde a la oficina ese día y se entera de la recolecta de dinero para el regalo de Lorena pero no sabe qué le van a comprar. Cuando Pilar te pregunta, tú le sugieres que la respuesta es obvia.",Pilar dice:,"""Veo que hay una recolecta para el regalo de Lorena pero ¿qué le vamos a enviar?""",Tú dices:,"""¡Todo el mundo conoce su obsesión! ¿Qué le enviarían a Lorena?""",¿Qué es lo que realmente implicas o quieres decir?,Quieres saber qué le enviarían a Lorena.,Crees que no le enviarían nada a Lorena.,Ya sabes qué le enviarían a Lorena.,option3
A,qué,10,ISQ,m_que_10_ISQ,mention all/some,"Un día durante el recreo de la escuela, tu amiga Mariana llega corriendo súper contenta. Ustedes le preguntan por qué está tan feliz y ella les contesta que su pareja le ha dado un regalo muy bonito. Justo después, se va corriendo y gritando de felicidad y los deja (a ti y a tus amigos) estupefactos. Uno de tus amigos comenta que ha de haber recibido algo que le gustó mucho. A ti te da mucha curiosidad saber qué regalo habrían podido darle a Mariana y le preguntas a tus amigos.",Tu amigo dice:,"""¡Wow! ¡Parece que su pareja la conoce bien si le dio un regalo que la hizo tan feliz!""",Tú dices:,"""Sí, parece estar muy feliz. ¿Qué le darían a Mariana?""",¿Qué es lo que realmente implicas o quieres decir?,Quieres saber qué le darían a Mariana.,Crees que no le darían nada a Mariana.,Ya sabes qué le darían a Mariana.,option1
B,qué,10,RQ-,f_que_10_RQ-,domain complement,"Tu amiga Mariana trabaja en una empresa pequeña y acaban de anunciar que ella es la empleada del mes. Desafortunadamente, esta empresa pronto va a quedar en bancarrota. Así que cuando Ana te pregunta cuál será el premio para Mariana, tú le sugieres que probablemente ella no va a recibir nada por causa de la bancarrota.",Ana dice:,"""Espero que Mariana reciba un premio muy lindo. Ha trabajado mucho.""",Tú dices:,"""Pero la empresa va a quedar en bancarrota. ¿Qué le darían a Mariana?""",¿Qué es lo que realmente implicas o quieres decir?,Quieres saber qué le darían a Mariana.,Crees que no le darían nada a Mariana.,Ya sabes qué le darían a Mariana.,option2
C,qué,10,RQ+,m_que_10_RQplus,unique referent,Tu amiga Mariana trabaja en una empresa de automóviles. Acaban de anunciar que ella es la empleada del año. Todo el mundo sabe que el/la empleado/a del año recibe un coche de premio. Juan se entera de que Mariana recibió algún tipo de reconocimiento y te pregunta qué podría darle la empresa de premio. Tu le sugieres que es obvio qué premio recibiría.,Juan dice:,"""Qué bien que reconocieron el trabajo de Mariana. ¿Va a recibir algo?""",Tú dices:,"""¡Es la empleada del año! ¿Qué le darían a Mariana?""",¿Qué es lo que realmente implicas o quieres decir?,Quieres saber qué le darían a Mariana.,Crees que no le darían nada a Mariana.,Ya sabes qué le darían a Mariana.,option3
